Rating,Company name,Website,First Name,Last Name,Job Title,Email,Phone,Industry,No of Employee,Country/Region,Source,Est Value,Topic
Cold,Apollo Pharmacy,https://www.apollopharmacy.in/,Sanjay,Chauhan,CIO,use valid email,4155550101,Pharmacy,1000,India,Web,50001,"Pharma CRM compliance requirements, SAP ECC to D365 migration approach"
Cold,Prestige Group,https://www.prestigeconstructions.com/,Ramesh,Kavya,VP Operations,use valid email,4155550111,Real Estate,500,India,Web,60000,Salesforce vs D365 feature comparison for construction industry
Cold,Reliance Digital,https://www.reliancedigital.in/,Rakesh,Aiyar,Head of Digital,use valid email,4155550121,Consumer Electronics Retail,500,India,Web,60500,"Azure OpenAI integration with D365, real-time customer insights for fintech"
Cold,Money control,www.moneycontrol.com,Suman,Das,IT Head,use valid email,4155550141,Financial Media Platform,500,India,Web,60000,Zoho CRM limitations in fintech companies
Cold,Fortune Media,www.fortune.com,Priya,Sharma,Operations Manager,use valid email,4155550151,Media,500,India,Web,60000,"Media CRM best practices, marketing automation workflows"
Cold,Agrawal Packers,www.agarwalpackers.in,Arjun,Mehta,Regional Manager,use valid email,4155550171,Logistics Relocation Services,500,India,Web,75000,Courier and delivery CRM process automation benchmarks
Cold,Zepto,www.zepto.com,Rajesh,Gupta,Owner,use valid email,4155550181,Quick Commerce,500,India,Web,102000,Digital adoption challenges in ecomerce retail businesses
